Contest ID,Index,Problem Name,Rating,Solved,URL,Tags
1986,G1,Permutation Problem (Simple Version),2200.0,1488,https://codeforces.com/problemset/problem/1986/G1,"binary search, brute force, combinatorics, data structures, math, number theory"
1968,G1,Division + LCP (easy version),1900.0,4259,https://codeforces.com/problemset/problem/1968/G1,"binary search, data structures, dp, hashing, string suffix structures, strings"
1914,G1,Light Bulbs (Easy Version),2100.0,1918,https://codeforces.com/problemset/problem/1914/G1,"brute force, combinatorics, dfs and similar, dp, dsu, graphs, math, trees"
1883,G1,Dances (Easy version),1400.0,11282,https://codeforces.com/problemset/problem/1883/G1,"binary search, greedy, two pointers"
1986,G2,Permutation Problem (Hard Version),2500.0,1081,https://codeforces.com/problemset/problem/1986/G2,"brute force, data structures, hashing, math, number theory"
1968,G2,Division + LCP (hard version),2200.0,1963,https://codeforces.com/problemset/problem/1968/G2,"binary search, brute force, data structures, dp, hashing, math, string suffix structures, strings"
1914,G2,Light Bulbs (Hard Version),2300.0,1399,https://codeforces.com/problemset/problem/1914/G2,"combinatorics, data structures, dfs and similar, dp, graphs, hashing"
1883,G2,Dances (Hard Version),1900.0,5453,https://codeforces.com/problemset/problem/1883/G2,"binary search, greedy, sortings, two pointers"
2014,H,Robin Hood Archery,1900.0,3411,https://codeforces.com/problemset/problem/2014/H,"data structures, divide and conquer, greedy, hashing"
2008,H,Sakurako's Test,2100.0,2863,https://codeforces.com/problemset/problem/2008/H,"binary search, brute force, greedy, math, number theory"
2000,H,Ksyusha and the Loaded Set,2200.0,1646,https://codeforces.com/problemset/problem/2000/H,"binary search, brute force, data structures, implementation"
1955,H,The Most Reckless Defense,2300.0,1262,https://codeforces.com/problemset/problem/1955/H,"bitmasks, brute force, constructive algorithms, dp, flows, graph matchings, shortest paths"
1945,H,GCD is Greater,2600.0,669,https://codeforces.com/problemset/problem/1945/H,"brute force, data structures, math, number theory"
